2162,specialfields refactoring,rewrite of #1964   this kept bugging me  so i invested some time in it. it integrates the changes from #1964 and turns the different special fields into enum values. the different classes composing special fields are now aligned to our architecture. the enum  specialfield  has to go to  logic  as it involves quite some localization.  there are still some possible improvements based on this pr  in particular: - outsourcing localization from  specialfield  so that this class can be moved into  model  (this is not necessarily needed  though) - rewriting  specialfieldsutil   which is already marked as deprecated.  to maintain a reasonable scope for this pr  these improvements should be done in separate new prs. they should now also be much simpler based on the new structure. -  manually tested changed features in running jabref,Network,UI,interpreter,Test,Logging,Util,IO,Search,App
2163,fix highlighting issues,2133.  earlier  highlighting was done manually by adding tags to matches in the html text being sent to the pane. instead  i have opted to make use of the highlighting features of the jeditorpane class. this gives the additional benefit that the highlight colour is changed automatically based on the system theme.   changes  - created jeditorpanewithhighlighting class - removed matchhighlighter class and its tests - removed highlighting related tests from layoutentrytest -   -   -   () -  -   ( ( -  if you changed the localization: did you run  gradle ate ?,App,Test,IO
2165,support \r when using citationstyles,fixes:   the citationstyle library cannot handle  \r  thus i parse to a  space . i also added another return (and localization) to always have a feedback for the user.,Test,IO,App,Logging,Util
2167,update vietnam translation,translation in vietnam language is on progress 🎅: - complete translation the entryfield for bibtex and biblatex   - insert new localization.lang keys - complete translation for shared database -   -   () -  -,App,UI
2169,fix failing ads test,added missing fields  2168,Util,Test,App
2175,fix memory leak in entry editor,this is to 2166.  list of changes - - updated microba to latest version - unregister entryeditor as a listener to entry  - implement searchqueryhighlightobservable using entrybus - make entryeditor unregister all fields that are listening on the global search bar.,Logging,interpreter,Util,App,UI,IO
2178,improve titlecaseformattertest,i had issues with  [title]  until i found that i should use  [title:capitalize] . during the search  i thought   title  was functioning wrong  but it doesn t. nevertheless  i added a test case and in parallel tried to change so that the one-assert-per-test-case rule holds.,App,interpreter,Util,UI,IO,Test,Network,Logging
2179,clear bibtexkey exception,2177. nullpointerexception caused by clearing bibtexkey field in entry editor. -   -   -   () -  -   ( ( -  if you changed the localization: did you run  gradle ate ?,Util,interpreter,App,IO,UI,Logging
2187,fixed close entry editor block,something went wrong with the old pr dealing with this issue. so here a new pr. fixes an issue with closing the entry editor. (i ve discarded some additional save action  because this might not be the desired behaviour.) here again the bug: fixed close action of entry editor not working after parsing (and invalid field) error corrected. 1. generate parsing error in source tab 2. save database 3. error message > edit 4. correct parsing error 5. close entry editor (x) blocked -   -   -   () -  -   ( ( -  if you changed the localization: did you run  gradle ate ?,App,Util,IO,Logging,Test
2193,google scholar: add better error message for reached traffic limit,title already explains the purpose.  as proposed by @tobiasdiez in  a more specific error is now shown if the fetching is failing due to a redirect. - ~~ ~~ - ~~ ~~ - ~~  ()~~ -  -   ( ( - updated text directly in the  gh-pages  branch:  -  if you changed the localization: did you run  gradle ate ?,Search,Util,App,IO,Network,Logging
2194,improve autosave and backup feature,applies the remaining feedback from  and fixes  -  -   ( ( -  if you changed the localization: did you run  gradle ate ?,DB,Network,interpreter,Logging,Security,Search,App,UI,Util,IO,Test
2195,enable version checker to recognize alpha/beta builds,the update checker is now able to handle alpha/beta builds. the alpha/beta tag has to be appended after the version number with a prepended  -  (eg.  3.7-alpha    3.7.1-beta ). i also suggest that the  dev  tag gets prepended by a  -  to make it easier to read (especially if its a pre-stable version (eg.  3.7-alpha-dev--snapshot )). currently this isn t necessary but it is supported.  the versionchecker only suggest non-stable builds if the currently installed version is also not stable (that s why i need to grab all the available versions now).,Network,IO,Util,Logging
2196,fix for #2184: add space after separator,seems to be as simple as that.  change has been introduced as the delimitor is no longer saved as a string      but as a  character  which chops away the space after the comma. - ~~ ~~ introduced in dev builds -   - ~~  ()~~ -  - ~~  ( ( - ~~ if you changed the localization: did you run  gradle ate ?~~,Util,App,Test
2198,integrity hotkey,the  check integrity -action seems to be in need of a hotkey. (see #1908) i used  ctrl + f8  for this action  because f8 is currently used to cleanup entries. these 2 functions seem to be related so it would make sense to group them. -   -  -  if you changed the localization: did you run  gradle ate ? -  internal qs,App,Test,Util
2199,refactor entryeditor & entryeditortab,i refactored many comments (some of them even referred to variables which do not exist anymore). i removed some unused methods  replaced some code with already existing methods and refactored a switch-case.,UI,App
2202,refactoring for pr #2051,@koppor refactoring follow pr #2051. take a look for merge pls 😄,Test,App,Util
2212,improvements to the javafx error console,the log messages in the list view of the error console can now be selected and copied. the error message will also automatically scroll to the newest log message. refs #2210,App,Logging,UI,Network,Util,IO
2213,fix strange styling behaviour of the error console,this should fix the wrong styling behaviour of the different log messages when scrolling. it seems like the styling error came because we never resetted the style classes of the cells when adding new ones. i also created a generic listfactory class (similar to #1917) so this issue won t occur in the future. refs #2210,UI,IO,Network,Util,App,Logging,interpreter
2217,autosave for shared databases,this _ui_ extension makes _shared databases_ (and also _autosave_ functionality) more popular as the combination of those two makes it possible to synchronize _bib_ files on the local file system  without saving them manually.  _screenshot:_ ![shd_autosave](  _changes:_ remove _autosave for shared databases_ option from _preftab_ and add an asking panel into connection dialog.  change the name of  open shared database -menu entries to  connect to shared database . -   () -  -   ( ( -  if you changed the localization: did you run  gradle ate ?,App,DB,UI,Util
2225,fix editor freeze,possibly fixes: #2220.,IO,interpreter,UI,Util,Logging,App
2226,fix for #2218: reenable ads fetcher,(see #2218),Search,IO,Test,Util,App,Network
2229,fix medline fetcher by using https,fix for #2228,App,Network,Search,IO,Logging,interpreter,Util
2234,global search usability improvements,some minor changes:,App,Logic,IO,UI,i18n,Util,Logging
2236,biblatex mode: add month and year field to deprecated tab,issue #2233: in biblatex the  date  field is recommended. for backward compatibility the bibtex fields  month  and  year  are also accepted. i ve added both fields to the deprecated fields tab  although the year field is present in the required fields tab too.,Logging,UI,App,Util,IO,interpreter
2248,moved return out of for-loop,i found some time to look into the code. it seems  only the last conditional statement was accidentally placed inside the for loop.,Test,Util,IO,App
2262,change log level to debug,fixes  a side aspects mentioned in #2249.,Logic,Util,App,Logging
2265,fix translation warning,in the javafx branch  jabref outputs,App
2266,when an isbn is not available on ebook.de  the error message is more clear.,when fetching a valid isbn from ebook.de  but the site has no data of the isbn  the error message just showed  filenotfoundexception . this pr fixes that.,App,Test,Util
2278,urls can be passed as command line arguments to the import,if an url is passed as an argument to the  -import  or  -importtoopen  command in the console  then the file is first downloaded and afterwards imported as usual. this functionality will enable jabfox to pass pdfs directly to jabref for importing.,IO,Util,Security,Logging,Network,interpreter,App,Test
2283,implement #1359: collect telemetry,in this pr  [microsoft azure application insights]( is used to record the following information about how jabref is used:,Logging,Util,UI,App,IO
2287,add fallback exception handler,previously  uncaught exceptions were simply ignored by our logging framework. with these changes  they are properly logged in log4j.,Util,interpreter,Network,UI,Logging,App
2291,javafx some small improvements,-->,Util,Test,i18n,IO,UI
2295,fix  no suitable driver found,i got the error message  no suitable driver found for jdbc:pgsql://fizzy-cherry.db.elephantsql.com:5432/zdndklfq  when using the session restore of shared databases of jabref. google pointed me to   which states that all drivers should be loaded before they are used.,Util,DB,App,Logging
2296,remove duplicate code getresolvedfieldoralias,the method getresolvedfield was in bibdatabase and in bibentry with identical same code. this pr removes the copy from bibdatabase.,App,IO,Logging,Util,UI,Security,Network,interpreter
2300,fix local metadata synchronization (fixes: #2219),issue: 2219.,Util,Logging,IO,DB,App
2301,readd drop down content selectors,first attempt at readding the code for,Util,App,IO,UI,Logging
2302,fix initialization of a shared database,fixes 2300#issuecomment-261801274.,DB,Logging,App,Util
2303,update citeproc dependency to 1.0.1,see https://github.com/michel-kraemer/citeproc-java/releases,Test,App
2306,adapt csl tests to crlf and lf,the discussion at  revealed that  \r  does not appear as line separator alone. thus  our tests should be adapted accordingly.,App,Test
2310,replace usages of throwable with exception,reviewing #2307 i noticed that  baseaction  and  abstractworker  use  throwable  in their method signature. i cannot find a reason for linking to the highest possible error type here. after all  this has nothing to do with jvm errors or the like.,UI,App,Util,Logging,IO
2314,rework dblpfetcher to new structure,also 2311,Network,Test,Search,App,Util
2317,cleanup emacs code,- this pr removes support of emacs<23 as this version of emacs disappeared even in [debian/stable](https://packages.debian.org/stable/emacs).,App,UI,Util,Network,Logging,IO
2320,installer code signing #1879,-,DB,Logic,UI,Logging,Network,interpreter,IO,App,Util,i18n,Test
2328,add bibtex key deviation check,refs #2206,IO,Test,Util,Logging,Network,App
2331,improve entrytype customization,goals:,Logging,Network,interpreter,IO,App,Util,UI
2333,seperate tests by categories  not by different folders,this implements 181,Test,Search,i18n,IO,DB,Util,Network,App
2339,fix biblatex cleanup for date field,this 2335,Test,IO,Util,App
2344,follow up for #1323 batch fulltext downloader,- 	rename menu item to plural for finding full texts,IO,Util,UI,Logging,App
2348,1446 only add non empty paths,suggest current bib folder when no defaults are set.,Util,App,IO
2349,integrity checker improvements,follow up for #1779,Network,Logging,IO,UI,interpreter,App,Util,Security
2352,remove old jdk bug as it should be fixed,see http://bugs.sun.com/bugdatabase/view_bug.do?bug_id=4760081,UI,IO,App,Util
2358,2012: use bibtexformat for month field in medlinefetcher,2012,App,Util,Test
2361,fix a few group related issues,this pr 2334  #1873 and #1681.,Util,Test,UI,App,IO
2362,[fx] review about dialog,-->,interpreter,IO,Logic,Search,DB,Test,Network,APM,i18n,UI,App,Util,Logging,Interpreter,Security
2364,be more friendly when using journal alias field,i d like to copy bibtex entries to biblatex databases and vice versa. when using required fields only  this works perfectly. when in biblatex mode  jabref does not display the value of  journal  in the required fields  because jabref demands the field  journaltitle . this is not only confusing for me  but also for other users: #2209.,Util,App,Test
2368,never manually set id of a bibentry,the internal id of a bibentry should never be set manually. closes #1721,Util,IO,App
2371,reenable more tests,-  corrections of wrong bibtex serializations: i inverted the tests for the file field so they test if the fields are not changed for \n and \t.,interpreter,Interpreter,Security,UI,Test,DB,Logic,Search,Logging,IO,Util,i18n,Network,App
2372,relevance and read status field actions were switched,2370,Util,App
2374,include  as fallback for the ebook.de fetcher,the fetcher offered by ebook.de does not offer bibtex for all valid isbns. this pr adds  as fallback for the ebook.de fetcher,Util,Network,Test,Logging,IO,DB,interpreter,UI,App
2375,preserve % sign inside bibtex fields via cleanup,2011,UI,Util,interpreter,App,Logging,Test,Network,IO,DB
2377,[fx] review key bindings dialog,-->,App,UI,Util
2383,[fx] review abbreviations dialog,-->,Logging,UI,App,IO,Util
2384,[fx] use native file dialog,-->,IO,App,UI,Util
2386,review mathscinet tab,-->,Network,UI,App,Logging,Util,IO,interpreter
2387,fix color,-->,Util,IO,UI,App
2388,rename  xmp data  to  xmp-metadata,i worked with the  import inspection dialog   which offers to offer entry-creation based on xmp meta data (refs #938). the dialog renders as follows:,UI,App
2396,introduce explicit list of all_biblatex_only_fields,this 2390. the last implementation used  entryconverter.field_aliases_ltx_to_tex . this implementation is based on  bibtexentrytypes  and  biblatexentrytypes .,IO,Test,UI,Logging,Network,Util,App
2400,2394 groups matching with brackets in name,2394.,App,Util,Test
2401,alllow ftp urls for downloading,i wanted to download ftp://ftp.informatik.uni-stuttgart.de/pub/library/ncstrl.ustuttgart_fi/inproc-2016-15/inproc-2016-15.pdf using the  download from url  button. however  this did not succeed as jabref insisted on an httpurlconnection.,IO,Test,App,Network
2405,datepicker fix,fix for #2403 - and as i was just touching this stuff again: i replaced our custom  easydateformat  class with a standard  datetimeformatter,Util,interpreter,IO,UI,Logging,App
2414,replace calls of bibtexparser.parse,this is a follow-up to #2139  so that we can finally get the pr into master.,IO,App,Util,Test,Network
2415,fix several file cleanup + rename issues,separated move + rename cleanup logic,Network,IO,App,UI,Util,Logging
2416,fix  collapse sub tree  functionality for groups tree,fix of #2319: function  collapse subtree  is working again,Logging,App,Util,interpreter
2420,remove the redundant worker interface,this is a refactoring pr (yeah  i know we do not really want pure refactoring prs for now)  and it is open for discussion (i will not throw a tantrum if it does not get merged).,IO,Util,Logging,App,UI
2421,revert  replace calls of bibtexparser.parse,-->,Util,IO,Network,Test,App,Search,Logging,Logic
2422,replace parse,-->,IO,App,Test,Network,Util
2425,2417: doi no longer contains url,-->,Network,Util,IO,Logging,Test,App
2428,2427: arxiv fetcher works with prefix,-->,Search,interpreter,App,IO,Network,Util,Test,Logging
2437,group all checker which only check the value of one field,most of the integrity checker only work on one field and thus i introduced a new abstract class which groups the common functionality.,App,IO,Util
2438,follow up #2428,-->,Util,Test
2440,add support for pages in the format 2:1-2:33,this fixes 212,Test,Util
2442,add  look up dois  to quality menu,this adds  lookup dois  to the quality menu. additionally: rename lookup to look up (see http://notaverb.com/lookup),Util,App
2446,make icon colors (and size?!) configurable,implementation of a [feature request at the forum]( colors can be changed now in the  appearance  preferences tab (see screenshot).,Network,IO,Util,Interpreter,Logging,UI
2452,incorrect log name of jabrefexecutorservice,-->,Logging,Util
2457,ctrl+f selects current query while the searchbar is focusd,implemented a feature request from the forum (http://discourse.jabref.org/t/ctrl-f-behaviour/408).,Logging,IO,Util,i18n,Logic,UI,App
2459,fix conversion of tilde n,and although i said that i would not work on jabref for the next two weeks  here is a pr. this stuff is addictive and i need help :-/,App,UI
2463,medline fix test,internal change only. fixed author in test data and removed keywords,Util,App,Test
2464,fix conversion of   n  and  \ {n}  from latex to unicode,this is a follow up for fixing  #2458,Test
2473,remove html code from acm fetcher,remove html code from acm fetcher,App,Network,Search,Util
2476,add update from doi to the entryeditor sidebar,implement 2432.,Network,App,IO,Logging,Util
2487,make sure that unregistered event sources do not stop jabref from shu…,…tting down,interpreter,Network,UI,Logic,Util,App,DB,i18n,Logging,Test,IO
2488,catch numberformatexception if context can t be parsed in groups,fixes  in the sense that a more detailed error message is displayed.,IO,App,Test,Util,UI
2492,fix medline testsagain,-->,Test,Util,App
2496,change key binding for cleanup from f8 to alt+f8,2251. this solution is the quick solution by changing the shortcut. the alternative is to change the actiontable etcl.,App
2507,fix apostrophe conversion,2500. this repairs the apostrophe handling in the latex to unicode conversion broken by #2464 and maintains the special handling of apostrophes in conjunction with the character  n  that #2464 intended to fix.,Test
2508,groups button and context menu for adding groups,-->,Util,App,Logic,Network,i18n,Search,IO,UI,DB,Test,interpreter,Logging,Security
2510,fix journal title in ris importer,fix for #2506.,Util,App,IO
2519,fix repeated escaping of % sign,extracted regexe in patterns,App,Test,Util
2520,revert  fix repeated escaping of % sign,reverts jabref/jabref#2519,App,Util,Test
2521,fix % sign cleanup,fix previous stackoverflow errror with large input,App,Util
2527,fix error when path is no valid directory,fixes the exception folder parameter must be a valid folder,App,UI,Util
2530,make doifetcher the default fetcher in new entry dialog,i think making the doi fetcher default is reasonable  i always need to select it otherwise as the first alphabetical entry is default for now.,IO,Logging,Network,Util,App
2531,check more results returned by crossref api for matching,2431,Network,App,Util,Search
2532,switch to latex2unicode,motivation is discussed in #2465. fixes many conversion problems  such as those discussed in #2063 and #207.,Parser,DevOps,Util
2538,fix import of ms office xml in case of invalid month,fix for:  http://discourse.jabref.org/t/msbib-import-not-working/463,App,Util
2541,enhance integrity check tests,see 162,Util,Test,App,IO
2549,correct naming of biblatex,2493,Util
2550,bib database -> library,2095,Network,i18n,Logging,App,interpreter,IO,Util,DB,UI,Logic
2554,replaced lrumap with a guava cache,this is intended as a fix for #2546.,App,Logging,Util,IO
2557,refactored around the fileannotationcache.,the cache now works as intended  i.e.  fully automatically instead of manual maintenance.,interpreter,IO,App,Util,Network,UI,Test,Logging
2558,move whole codebase to package  org.jabref,implements #1179,IO,Util,App,Test,interpreter
2563,make automatic groups a first-class citizien,-->,App,UI,Util
2564,remove groups edit mode,-->,UI,Network,App,Util,Logging,IO
2567,fix npe on tab switching in entryeditor between mr dlib,and file annotations,Util,App,Logging,interpreter,UI,IO
2568,fix medline fetcher test,add missing/changed fields to fix test,App,Util,Test
2575,check similarity of entry when using doi retrieval with arxiv,2570,Network,Util,UI,interpreter,IO,Logging,App,Test
2582,localization tests,test for #1985,Util,IO,Test
2583,keyword - special field synchronization,2580,App,Util,UI
2585,replace urldownloading logic,imho the downloading logic should be based on some stable  library.,Network,App,Logging,Util,interpreter,IO,Security
2588,implement #1904: filter groups,-->,Test,UI,App,Util
2601,remove ordinalstosuperscriptformatter from recommended biblatex save actions,2596,Test,UI,Util,Logging,Network,App,IO
2610,fix title-related key patterns in bibtexkeypatternutil,-->,App,Util,Test
2611,fix exception when parsing groups which contain a top level group,fixes the import of #2600,IO,Test,App,Util,UI
2612,add icon + color and description to groups,-->,IO,Interpreter,Network,Logging,UI,Util,App
2614,cleanup window has a scrollbar now.,fix for issue #2501.,App,Util,IO,UI
2616,fixes displaying of mr dlib recommendations,fixes 231,interpreter,UI,Logging,Util,Test,IO,App
2618,fixed wrong logger import,fixes the first part of #2617,Logging,IO,Util,App
2621,add mathscinet as id-based fetcher,-->,UI,App,Test,Logging,IO,interpreter,Util,Network,DB
2623,fix2613,provided a macos specific routine for opening tex editors to import citations to 2613.,UI,IO,Logging,App,Util
2624,refactored around the pdf annotation importer,- i mainly refactored the pdfannotationimporter. it now uses java.nio and has sane error handling.,Logging,Util,IO,App,UI
2625,change dialog of download fulltext to save dialog,fix for #2572,Logging,UI,App,Util
2628,filenames,-->,App,IO,Util,Logging
2632,add drag and drop for groups -> groups,-->,interpreter,App,Logging,UI,Util
2634,finally write the new group properties to the bib file: icon with color  description  expanded status and automatic groups,-->,IO,App,UI,Util,Test
2636,improve perfomance of opening a database that still used the old groups format,-->,Logging,DB,Logic,UI,App,IO,Util
2639,add option to copy title of bibentries,implements issue 210]( from [@koppor](https://github.com/koppor).,Util,Logging,Network,App,UI
2640,put the pdfannotationimporter under test  enhance fileannotationtab,i have created tests for the pdf importer. however  the coverage has yet to be improved and i m planning to extend the fileannotationtab in this pull request. so this is the follow-up for #2624  but this time in tdd.,Util,Test,IO,App,UI
2641,improve issue reporting a bit,see #2573.,Util,UI,Logging,Network,IO,App
2644,refactor oo connection,also 2484,Network,Logging,IO,Util,App,UI
2645,2455: add crossref as fetcher for everything (id-  entry-  search-based),-->,Logging,UI,interpreter,App,IO,Network,Util
2649,paying off technical debt: almost all utility classes have a private constructor now.,i also removed an unused private method. according to sonarqube scans  this removes at least five days of technical debt.,Logic,interpreter,App,IO,Util,Search,Test,Logging,UI,i18n,Network
2650,performance improvements related to import,-->,UI,App,Util
2659,oo formatting,openoffice text formatting now handles nested tags properly 2483](#2483),App,i18n,Logic,Logging,Util,IO
2661,add possibility to clear the log at runtime,2660,App,Logging,Util,UI,IO,Network
2666,add sorting of all groups and subgroups  recursively,implements some features from #2599,DevOps,Parser,Logging,Network,interpreter,UI,App,Test,APM,IO,Util,Security
2669,fixed issue #2652,commas should only be interpreted as separators of several authors if there is no possible interpretation that conforms to the bibtex rules  i.e. if there are more than two commas.,Test,Util
2670,revert  paying off technical debt: almost all utility classes have a private constructor now.,reverts jabref/jabref#2649,Search,UI,APM,Network,App,DevOps,interpreter,IO,Util,Logging
2681,2680 and 2667: swing errors are catched properly and without freezing,hopefully  fixes that the error console is not updated properly #2667 as well as that swing errors lead to frezzing #2680. at least for me  it works now without problems. @stefan-kolb @lynyus can you please also check it.,App,UI,Logging,Util
2683,fix selecting all entries with shortcut,fixes 2615,Logging,IO,UI,Util,interpreter,App
2684,fileannotationtab now only shows the filename  not the full path.,2676,IO,App,Util
2688,export single corporate author to ms office xml,if the author in jabref is enclosed in curly braces .e.g  {jabref developers}   it is now recognized as corporate author and exported in the corresponding field.,Test,Util,App,Network
2692,add pdf viewer,-->,UI,App,IO,Util
2697,remove the following commands in the right-click menu of a group:,- expand/collapse subtree,App,Logging,Util,interpreter
2699,parser no longer warns about empty bibtex keys,-->,App,Test,Util,Network,IO
2702,open main file directory in correct file dir,change to fxdialogservice,IO,Util,UI,App
2703,628: implement hierarchical keywords,-->,UI,Test,Util,App
2704,write groups under tag  group  instead of  groupstree  to enhance compatibility with previous versions,right now  files written with 4.0 cannot be opened in older versions. the new format of the groups leads to a npe.,IO,Test,Logging,Util,UI,App
2710,add arxiv identifier batch lookup,-->,Util,Test,Network,App,interpreter,Search,UI,Logging,IO
2711,avoid conversion of single underscores,2664,App
