1160,remove %s in formatter descriptions,in the developer telco  we discussed that we don t want to have  %s  in the descriptions of formatters. this pr removes the last two remaining  %s .,App,Util
1161,add method getexampleinput() to format class,i added  getexampleinput()  to the formatter class to improve #1050.,Test,App,IO,Util
1167,positionwindow automatically installs resize event listener,instead of always having to copy and paste the same code  the componentadapter is now automatically installed.,UI,Util,interpreter,App
1168,1163 by removing the strange functionality which enabled sorting…,we have some very strange logic in jabref which allows to handle years using only the two last numbers  so we can detect that 68 means 1968. this causes a lot of issues. i do not think that jabref should still support such strange logic  and just use the value which is in the year field.   hence  i removed it.   this also solves the issue of having that yearutil in the model package which duplicated a method in the stringutil class.   refs #1163,Util,Logging,Network,UI,App
1170,some minor cleanups,a little bit of everything maybe one should wait until after 3.3 is released before merging this?,UI,App,Network,Util,IO,Logging
1184,use paths.get() instead of url.getfile() - fix failing tests,fixes problem with failing tests due to whitespaces,Test,IO
1195,small fixes,first commit is some code cleanups. the rest is mostly spelling and localization consistency.,IO,Logging,UI,Util,App
1200,moved more methods from util.util,now there are very few methods remaining in util  i m not convinced about keybinder. maybe a semi-bad name and maybe should be in gui.keyboard instead (and probably should be used more).,UI,IO,Logging,interpreter,App,Util
1201,added method to generate string with n spaces or n characters,used in a number of places so makes sense to have a method.,interpreter,App,Util,IO,Test
1202,replaced some guava usage with standard java.*,while looking for the use of guava i found these calls which can be replaced with standard java-classes.  regarding the original quest: - most uses are for checking null or empty strings or similarly return an empty string if the input string is null  it may not be worth importing the library just for these two and better to create these two trivial methods in stringutil (and use them to a larger extent) - there is also  charmatcher.whitespace  which may be slightly less trivial to replace,Network,Util,Logging,Search,App,IO
1205,change output level from info to debug to remove clutter in the output,when openning a file and special fields are used  users currently **always** get the message  info net.sf.jabref.importer.opendatabaseaction - synchronized special fields based on keywords  displayed. this is confusing. see for example   currently  jabref uses  info  for errors and warnings  too:  ![grabbed_20160414-125653](  the synchronized message is a debug message  which should not be shown in the general case.  to be consistent with the current logging approach  i changed the log level for a message from  info  to  debug . this also reduces clutter in the log and on the console.   the alternative is to rethink all log levels and the preferred default output.,Logging,IO,DB,App,Util
1207,restructure importers,the aim of this pr is to reduce the overlap between the importer package and some code in gui (in particular  the class opendatabaseaction). moreover  #1080 and #1153 are fixed.  in detail  the following things were changed: - the abstract  importformat  class is almost completely rewritten. please have a look at this class. almost all other changes are a direct consequence of the edits made to the importformat class. the biggest change is that the import method returns a  parserresult  instead of a list of entries (in this way  metadata can also be imported and error messages are communicated more effectively instead of throwing ioexceptions). moreover  the import method operates on a reader instead of an input stream in order to reduce some common code in all importers. -  add method  importdatabase(path file  charset encoding)  to the importer interface which opens the file and passes the stream to the other import method. - the bibteximporter overwrites this new import method and uses the logic from  opendatabaseaction.loaddatabase  to determine the encoding of the bib file. - change opendatabaseaction to operate against the bibtex importer.  - remove get/set iscustomimporter: was not really used (just for sorting - now everything is alphabetical) - empty entries are no longer imported (thus a few test had to be changed)  remark: the methods getextension and getdescription are not implemented by almost any importer. this should be done. maybe this is something for the stupro?  (will add the changelog entry and add a few tests later) -   -   -   (),Network,Util,App,Test,Logging,interpreter,IO
1208,fix that fieldformatters run although they are disabled,as reported by @stefan-kolb  the field formatters run although they were disabled. this is fixed with this pr. -   -   -   (),App,IO,Util,Test
1215,improved conversion maps and conversion speed,the html/unicode <-> latex conversion map source was based on regular expressions making it a jungle of backslashes. now  replace is used instead of replaceall so fewer backslashes and (theoretically) a bit faster.  i also added benchmarking for the following conversions: - html to latex (used at import  cleanup and save action) - latex to html (used for preview) - latex to unicode (used for table rendering)   and i got a slight improvement  although i cannot really tell why the two latter are faster now as they are based on cleaned versions one reason might be that the tests are based on latex symbols with more backslashes in them for the old case  before: benchmarks.htmltolatexconversion      5533.070 ▒   86.148  ops/s benchmarks.latextohtmlconversion     141500.226 ▒ 8011.038  ops/s benchmarks.latextounicodeconversion  124527.930 ▒ 3984.776  ops/s  after: benchmarks.htmltolatexconversion     6153.450 ▒   114.716  ops/s benchmarks.latextohtmlconversion     168037.040 ▒ 13412.341  ops/s benchmarks.latextounicodeconversion  173674.308 ▒  7455.006  ops/s  here one can see that only searching the string to be converted once is far better than running replace on all possible characters. which is not surprising  but require quite complicated code.  finally  with the simpler strings it was easier to add most (all?) of the curly brackets required to solve #405 .,Util
1216,refactored cli code,moved code related to the cli to the cli package  including half of jabref.java.,Test,UI,Logic,Util,IO,Logging,Network,DB,interpreter,App,i18n
1217,added integrity checker for odd number of #,will sometimes help for #1212 and #1188,IO,UI,Test,Logging,App,Util,Network
1219,refactored some dialogs,extracted some code to methods.,App,UI
1229,1091 apply and ensure correct import sort order,see #1091,App,UI,Util,Logging,Network,interpreter,IO
1230,removed some issues and encapsulated some fields,- encapsulated fields and extracted methods in basepanel - some minor code cleanups,Network,UI,IO,interpreter,Logging,DB,Util,App,Logic,i18n
1238,added integrity checker to detect html encoded characters in fields,based on discussions in #1188,Util,Test,IO,App
1240,removed leftovers from option to edit in table cells,found some unused code when doing translations. this is a left over from when it was possible to edit in the table directly.  i ve earlier seen some code which checks if a single cell is selected. that should also be safe to remove i assume (i was a bit confused why it was ever there  but now i think i know the reason).,Util,Logging,App,IO,Network,UI
1241,add test for msbibexportformat,in this pr the class msbibexportformat will be tested. the logic of this class will be found at msbibentry.java and msbibdatabse.java. i also edited the address_pattern in msbibentry.java so that the regex described in the comment will be matched.,IO,Network,Util,App,Test
1244,fixed so the resulting type does not become misc when merging two ent…,apparently  the type of resulting entry was not set correctly,Util,UI,App
1246,fixed #1245,this should 1245 so that it is possible to set empty strings is jstyle-files as  key=,Test,Util,App,IO,Network
1250,replace general get/put/remove metadata calls with typed versions,also removed support of legacy user-specific file paths (serialized with a @ symbol). jabref stopped writing this format over 3 years ago (according to  -   -   -   (),App,UI,Test,Util,Logging,APM,interpreter,Network,IO
1260,cleanup of cleanup dialog,- remove unnecessary cleanups which are replaced by field formatters (ordinals to latex and unicode to latex) - field formatters in the dropdown box in the cleanup dialog are now correctly displayed using the name instead of the key ##  -   -   -   (),UI,App
1261,cleanup now uses active preferences,previously  the cleanup used the preference state from the program start and not the most recent preferences. this is fixed with this pr. -   -   -   (),Util,App
1262,remove some unused code in importinspector,-   -   -   (),IO,Util,App
1265,restructure help pages,help pages are now all listed in one file.  see:  (i cant  get the crosslinking right) ~~use given encoding when writing sql-files~~ (no longer relevant) refactored some db exceptions -     @mlep  have a look at the helpfiles java file there are all help pages listed which are atm used. the one with the empty strings (  ) atm don t have a help page associated  but should (at least the fetchers) (except for contents  as it links to the toc of the help pages.  @oscargus  as you worked on the cli classes recently  is there a way to link to the help page like in the gui dialogs? https://github.com/jabref//blob/gh-pages/en/commandline.md,App,Test,UI,Util,interpreter,Logging,i18n,Network,IO,Logic,Search
1273,improved integrity check dialog,- table can be sorted - editing disabled - resize properly if a different menu font size is used - extracted to its own class  also made writing of  bibtex key  consistent.,Util,Logging,App,IO,UI
1278,tried to 1251  but all tests pass,will merge this in if the tests all pass on the ci server. -   -   -   (),Util,Test,App,IO
1279,more tests for doi cleanup and a small fix,tests when doi in url-field.  fix so that the fieldchange new value is null instead of    after removing field contents.,IO,App,Test,Util
1282,1271: authors with compound first names are parsed properly,-   -   -   (),Util,Test,App
1296,improve bibtexentryassert,this is a follow up of  #1281 with removing obsolete bibtexentry.assertequals methods,interpreter,App,IO,Util,Network,Test
1297,minor bibentry tweaks,- remove obsolete settings of  changed  variable - remove empty line - use formatting rules for additional brackets in conditions,UI,Network,App,Logging,Util
1298,added option to copy version information in the about dialog,added option to copy version information of jabref in the about dialog as described in #871 . this will help with filing issues and bug reports as the version of jabref  os and java will be copied.  -   -   -   ()  ![screen shot 2016-04-25 at 22 38 58](https://cloud.ent.com/assets/15340757/14798171/915a5bbc-0b36-11e6-8bbf-b01cb100b2cd.png),Util,IO
1300,1290 change jabref help to online help,- all translations must be added again,Logging,App,IO,interpreter,Util,UI
1304,implemented jstyle file filter and opening in last dir,filter filter for jstyle files #1294  extended browseaction to display file filter fixed npe when selecting invalid jstyle (prevented style dialog from opening) -,Network,UI,App,APM,Util
1309,minor updates to bibentry,- <s>rename citekey to bibtexkey to be consistent with wording of jabref users</s> - reorder methods in bibentry to follow id  cite key  type  everything else - add some javadoc - remove obsolete setting of  changed=true,Util,Logging,UI,App,Network
1310,1295 npe when sorting tabs,- selected tab might be null when sorting tabs - the logic is really strange in general  so this fixes the problem but we need to rework the actions enabling in general imho.,Logging,UI,App,IO,Util
1317,take srceenshots in gui tests,this pr adds the possibility to take srceenshots in gui tests. the idea is that srceenshots for the website can easily be updated for a new version by just running the gui tests.  the images are stored in  builds/srceenshots/ . -   -   -   (),Test,i18n
1318,update localization instructions,corrected gradlew task name #1312  @koppor  @stefan-kolb,IO,Test,Util
1329,cleanups improvements,- fix move files cleanup (link between gui and logic was missing) - add  all  to field names combobox for field formatters cleanups  - make latextounicode converter available as cleanup - combine casechangers and bibtexfieldformatters to formatters class ##  -   -   -   (),Network,App,Logging,IO,Util,UI
1330,normalize pages formatter does not remove letters in page numbers,formatting the page range  r1--r50  resulted in  1--50 . now nothing is changed. moreover   43 -- 103  is now correctly converted to  43--103 . -   -   -   (),Util,App,Test
1335,improve symmetric diff,changes are only highlighted. see the doi field in the following screenshot. previously the change  was written as  msp~~msp~~ . ![untitled]( also fixed some smaller bugs in the symmetric diff (like accidentantly removed whitespace). -   -   -   (),App,UI,Util
1336,refactor open and save dialogs,complete refactoring of the ugly and propably outdated filedialogs code newfiledialogs will be renamed when the work is done atm i want to keep it parallel.  todo: -  refactor getmultplefiles  -  provide methods for other open and save dialogs  -  replace openfilefilter with filenameextensionfilter   -  refactor browseaction to use new the methods -  test #1324  again,Util,Test,DB,App,interpreter,i18n,IO,Logging,UI,Logic
1348,normalize page cleanup also replaces em dash,<describe the changes you have made here:   > -   -   -   (),Test,App,Util
1349,1347 open urls does not work with query strings,this should work with query strings like    and normal urls.  however  the question is: does this impact the opening of any other file path or anything? we need to be careful as this is a generic open method. maybe that s also the problem because it needs to handle any kind of uri.  @siedlerchr @tobiasdiez please take a look.,App,IO,Util
1350,fix npe on selecting invalid jstyle,follow up from #1294   npe was raised in comparator because name was initialized with null instead of empty string only store preferences if style is valid  @oscargus  the fix has the side effect that a file where the name can not be parsed correctly is displayed as  empty style . i attached the problematic style file which was provided in #1294  however: valid still returns true.  as you have worked recently with the styles things  do you know what is required for a jstyle? @koppor  maybe you know this? then we could improved the validity check   [campus_format.english.txt]( ![emptyjstyle](https://cloud.ent.com/assets/320228/14995084/4d8c3a3e-1173-11e6-8eb6-e8f5490ffa5e.png),App,IO,Network,Util,Test,Logging
1355,update preview panel on generate bibtexkey,fix for #1353 fixed some missing unlocks some formatting -,Util,App,Test,UI
1368,removed possibility to automatically add braces via option - preferen…,…ces - file - store the following fields with braces around capital letters. please use save actions instead for adding braces automatically.  refs #1351,App,IO,Util,Logging
1369,1313: remove ui as the checkbox is no longer backed by a config …,…option  see #1313,App,UI
1374,register listener for correct entry,-   -   -   (),Util,Logging,IO,App,UI
1375,add overload for stringy urls in urldownload,-   -   -   (),Util,Network,Search,App
1376,small improvements for page normalizer,see test cases. -   -   -   (),Util,App
1377,merge master into javafx branch,<describe the changes you have made here:   > -   -   -   (),APM,i18n,Logic,App,interpreter,Test,IO,Network,Util,Logging,Interpreter,UI
1383,implemented error console in javafx,this is the error console in jabref being implemented in javafx. the console is highly flexible in positioning and styling its components through a fxml and corresponding css stylesheet.  also to show better the error console content (log  output  exception)  i have allowed to resize error console windows manually.  ![error console dialog](  ps: - update the error console screenshot - new feature:   - copy log: user can copy the log   - report issue: user can report directly issues from console. #872: have done -   -   (),Util,App,Network,UI,interpreter,Logging,IO
1384,1334: display correct number of entries in static groups,<describe the changes you have made here:   > fix of #1334. nice bonus: total number of entries is displayed after  all entries  group. -   (bug not present in 3.3) -   -   (),interpreter,Logging,Network,UI,Util,App
1386,entries retain their groupmembership when undoing their cut/deletion,when undoing an entry which was deleted/cut while a group was selected of which the entry wasn t a member of it was after the undo.  i fixed that. ### steps to reproduce - delete an entry - select a group of which the entry wasn t a member of - undo the deletion - now the entry is a member of the group,IO,Security,UI,interpreter,Logging,Network,App,Util
1388,fix sorting issue #1357,the logic is fucked but this should fix the issue.  problem was that when sort in original order was selected  the corresponding variable newsortorder would still read the disabled sort order inside the jdialog.,App,Util
1389,1381 file links containing blanks are broken if non-default viewer is set,runtime.exec with a string splits on white spaces,App,Util,IO
1390,ported the keybindings dialog to javafx,the keybindings are now organized in categories referring to the jabref menu titles. the button grakey has been removed and once a entry is selected the table listens for valid key combinations. the fxalert class has also been adjusted to listen to the closedialog shortcut. -   -   -   ()  ![keybindingsfx]( ![keybindingsfxdefault]( ![keybindingssuccess](https://cloud.ent.com/assets/15340757/15216596/0222bbb8-1858-11e6-96d7-bb2d7a3d0f4a.png),Logging,IO,interpreter,App,UI,Util
1397,add fields for nbibimporter and add testfile,regarding: 1063]( the medlineplain importer doesn t have all fields  that the nbib format has. so i added the fields to the medlineplain format and added a test+ testfile for the nbib format. a list of the elements that should be imported now  can be found [here]( -,App,Util,IO
1401,1399 export to html: html code is not well-formed,always write the footer  no matter if encoding is given or not.,Test,Util,IO,App
1403,fix small event bug in previewpanel.java,this bug caused a  missing event subscriber  exception  when clicking on different bib entries in preview mode.,Logging,UI,Util,App,IO
1409,cleanup guiglobals,implements #1408  cleans up the  guiglobals  class and move  latexfieldformatter  to the  bibtex  package  which is now independent of the  gui  package.  as a final step  i would move the class  net.sf.jabref.importer.fileformat.fieldcontentparser  to the  bibtex  package  which would make the package self-contained (apart from imports to the preferences and related classes) and would move the whole  bibtex  package into  logic . are there objections to this?,App,UI,APM,Network,Util
1411,move encoding from basepanel to metadata,<describe the changes you have made here:   > -   -   -   (),IO,Test,Util,App
1427,remove groups -> settings -> select matches,as discussed in  this option does not work and should be removed. actually there is absolutely no code backing this option. -   -   -   (),App,Logging,IO,Network,UI,Util
1440,1420 auto downloader should respect file pattern and propose correct filename,(https://cloud.ent.com/assets/2141507/15472274/898030a4-20fa-11e6-9a77-8cfac10688d5.png),Util,App,IO,Test
1442,remove expandauthorinitials again,was reintroduced in  will merge directly after tests pass.     --> -   -   -   (),Util,interpreter,App
1443,651: improve parsing of author names containing braces,651. -   -   -   (),App,Test,Util
1451,implementation of shared database support,implementation of **shared database support** for mysql  postgresql and oracle database systems.  made changes: - old  sql package removed. _(this request aims to replace the old system completely)_ - _automatic_ change push to the server via eventbus. _(support for all kinds of entryevents  see  - full synchronization support for mysql  postgresql and oracle   _(manual and semi-automated pull)_ - conflict avoidance by version control and [_optimistic offline lock_]( - efficient _pull_ using version numbers - synchronization of metadata with conflicts avoiding mechanisms - metadata appliance - groups synchronization - mode synchronization _(mode switch on the fly possible)_ - adjusted tab and window titling - new localization entries - ui dialog for opening new or existing shared database - ui dialogs for resolving conflicts between bibentries - key bindings - connection loss handling - switch to offline working mode - driver availibilty check _(e.g. for the dropdown list)_ - tests for all classes localized in shared package - synchronization tests  _screenshots:_  ![open_rem_db](  ![shareddb_sc1](  ![shareddb_sc2](  ![shareddb_sc3](  ![conn_lost]( -   -   -   (),Logging,IO,App,Test,Interpreter,DB,UI,Network,interpreter,Security,Util
1453,refactor placement of parsing and writing logic,according to the following conventions: - all objects which can be read from a string have  public static type parse(stringy input)  method. - all objects which can be written to a string have a  public stringy getasstring()  method.  should 888. ##  -   -   -   (),IO,Network,UI,Test,App,Logging,Util
1459,create update checker for the enduser,implements #661.  the updater regularly checks if there is a new stable version of jabref available [via github api]( if there is  a dialog will popup:  ![newversion]( -  download update  points directly to [fosshub]( -  ignore this update  will ignore this specific version on automatic version checks -  remind me later  will inform the user on the next version check (automatic or manual) of this version -  view changelog  points directly to the changelog specific to this version (eg. v3.3 would point to   under  help  there is another button to check for updates.  ![updatetab]( under preferences you can see: - the current version - when the version was last checked and a button to check it now - if there s a new version available and a download button - if a version was ignored and a button to unignore it - you can also define how often the automatic check should occur,Logging,UI,DB,App,interpreter,Logic,Network,Test,IO,Util
1460,1455 npe when retrieving bibtex data from doi,see #1455,Test,Logging,Network,UI,IO,Util,App
1466,add missing status translations for various specialfields,the status messages for some specialfields have not been translated correctly (missing localization has not been detected automatically as a variable has been used.) -  refactor java code to directly use  localization.lang  consistently for all specialfields -  lookup missing translations in previous releases  -  fix npe when clearing multivalue fields (ranking  priority  read status),Util,App
1471,preserve user comments in bib file,so i am finally having my take at #1026. the current solution was surprisingly easy so far (despite what i had written before). it looks explicitly for our encoding prefix in the file ( encoding:  ) and kills lines that contain it (but only lines preceding an entry  it will not delete something that is inside an entry). other user comments are left untouched and are _always_ written out again  even if the entry is reformatted.  user comments that are above meta data  bibtex strings  or the preamble will still be removed  though. changing that would require large scale changes to these items in our model  since we would also need to store the parsed serialization for them  which we do not do so far.  this should receive significant automated  but also manual  testing  since it modifies a quite critical part and has the potential to destroy bib files. i will add a few more tests for this pr. -   -,Test,Util,IO,App
1472,refactor writing of bib files,the main aim of this pr is to simplify the implementation of  (sql export) and other exporters. - abstract class bibdatabasewriter  which controls the generic things of   writing a database (i.e. sorting entries  applying save actions  some   basic conversations  ) - derived class bibtexdatabasewriter  which only contains logic how to   actually write to in bibtex format (should be simple to write similar   classes for other export formats like ris) - make savesession abstract and introduce two implementations which   write to a temporary file (filesavesession) or two a string/buffer   (stringsavesession) - move code related to lock files to filebasedlock ##  -   -   -   (),interpreter,App,Util,IO,Test
1474,1434: static groups are now longer displayed as dynamic ones,reason for this bug: explictegroup now derives from keywordgroup and thus was sometimes displayed as a keyword group. -   -   -   (),Util,IO,Logic,Logging,interpreter,Network,UI,App
1479,rewrite medlineimporter with jaxb and add nbib fields,regarding:1063]( i ve rewritten the medlineimporter (to be more specific: the  importdatabase  method)  so that it uses a jaxb parser now  instead of a sax parser. i ve also added the nbib fields to the importer. tests for the changes will be coming. -   -,IO,App,interpreter,Logging,Util
