1,new sorting/export preferences,this will add a new  file sorting  tab to the preferences that allows to exactly specify the sort and export order of entries  rather than the rather limited set of choices that were available to date.,UI,Network,Util,IO,interpreter,App,Logging
7,i have implemented 2 features requested in ticket #841.,the user can now specify an arbitrary number of file-link columns in te  entry table columns  preferences tab  to be added to the main table. the user can any file types specified in the list of external file types. the extra columns work exactly like the original file-link column.  for each file-link column whenever there are multiple files  the letter  m  is displayed at the bottom right corner of the icon.       committer: noravanq   on branch master  changes to be committed:    (use  git reset head <file>  to unstage)      modified:   src/main/java/net/sf/jabref/guiglobals.java modified:   src/main/java/net/sf/jabref/jabrefpreferences.java modified:   src/main/java/net/sf/jabref/tablecolumnstab.java modified:   src/main/java/net/sf/jabref/gui/maintableformat.java modified:   src/main/java/net/sf/jabref/gui/maintableselectionlistener.java modified:   src/main/java/net/sf/jabref/gui/preventdraggingjtableheader.java,App,UI,Logging,Network,Util,IO
10,try to fix some obvious bugs about  groups,hi all  i just upgraded to 2.10 and i found some bugs immediately. 1. in the right-click-menu there is no  move-to-group  but 2  remove from group  instead. 2. i like the new add/remove/move panel  but the scrolling is not working  which is a big problem. because i have lots of groups which cannot even fit into the full screen height after expansion. 3. no way to expand or collapse all nodes  i tried the dev version  all problems still exist. here is my fixation.  cheers   w.l.,App
11,bugfix for bug  #880 pubmed import broken,found bug: pubmed/medline plain format recognized as ris format. provided solution:     - modified ris importfilter. now ris format is identified by looking for the  ty  tag (it is a mandatory tag in ris format and it is not conflictual with other filters)     - added new importfilter  medlineplain . this import filter parses medline files in plain format (not xml). the import filter has been produced referring to the official medline documentation (     - updated the net.sf.jabref.core plugin.xml file in order to include the newly added medlineplain import filter,IO,Util,App
13,language locale fix for bug959,i tried to change hard code with in-code strings to global.lang and changed icon for dialogue window from warning to error.,Util,IO
15,make (un)abbreviating journal titles also work on the journaltitle field,i ve (i) added the toggle button to the  journaltitle  field editor and (ii) made the abbreviate/unabbreviate actions change both the  journal  and  journaltitle  fields. the latter might be a bit simple-minded --  should the field to consider depend on whether biblatex mode is actually turned on?,App,Logging,Util
18,fix edits getting lost in biblatex mode,this fixes a bug where edits made in a field on a compressedentryeditortab wouldn t get stored when the field editor lost focus. the bug was caused by entryeditortabfocuslistener accessing the unused inherited parent field of compressedentryeditortab instances instead of the latter class s own (private) parent field. instead of doing just a quick fix  i decided to eliminate the excessive code and data duplication in the two classes altogether and consolidate them into one class (with an additional flag to the constructor)  since i don t think an extra class is warranted here (and easily and sensibly implementable by derivation).,Network,UI,Util,Logging,IO,interpreter,App
19,fix error when setting unset field in source panel,when the user tries to set a previously unset field of an entry via the source panel of the entry editor  the program complains with an error message and refuses to store the field values. this change fixes that behaviour.,UI,App,Logging,interpreter,IO,Util
22,extended the  unknown entry type  error message,i had problems locating which entry had this unknown entry type and hence extended the error message to also include the bibtex key.,App,IO,Util,Logging
24,extend biblatex: support for alias fields,- added support for aliased fields. for example  the content in the  journaltitle  field is also shown in the  journal  table. - added cleanup option to convert to the new biblatex format - modified the required/optional fields for biblatex entries to reflect the above changes (the  year  field is no longer required),App
27,partial fix for bug #913,realized many fields were not being exported  not only in .csv and .ods formats as stated in the bug report  but in .sxc as well. i fixed the export for both .ods and .sxc  but couldn t figure out how to fix it for .csv.,Util,interpreter,Network,Logging,App
28,added special fields  printed  and  read status,added special fields  printed  and  read status   thereby implementing (at least partially): - feature #762 printed attribute - feature #692 marking of new entries and often read entries - feature #685 highlight new entries that were  forgotten  - feature #602 could add the mark as read feature - feature #225 read? checkbox  printed is just a boolean toggle and for the read field currently the values  skimmed  and  read  are possible (if you have any suggestions for further possibilities  i m happy to implement them). the icons are taken from  and should probably be replaced with icons from the same collection as the other currently used ones.,IO,Util,Logging,App,Network,UI,interpreter
29,fixed bug #1240. 1-char strings working correctly.,fixed bug #1240  about an error thrown when trying to add a string with length of one character.,Util
44,add entry under the  view  menu to hide the toolbar,in addition  i would suggest to hide the toolbar by default.,UI,Util,Network,App,Logging,IO
45,added the option to change the table row height padding.,previously  the padding added to the row height for the main table was hardcoded. the padding value can now be modified by the user through the preferences dialog. the old hardcoded value is used as the default value for the new preference.,Network,Logging,App,UI,interpreter,Util,IO
46,add option to hide/show gridlines in the main table,cleaned-up version of older pull request 43,interpreter,App,IO,Logging,Network,Util,UI
47,added the ability to reorder the panels in the side pane.,side pane panels now feature an up arrow button and a down arrow button immediately to the left of the close button. these buttons allow panes to be swapped with the pane above or below them  respectively.  whenever the panes are reordered  the current position of each visible pane is recorded in the application preferences  so the user s custom ordering can be preserved when jabref is next run.,Util,App
48,add the option to save selected entries as plain bibtex.,adds a new menu option called  save selected as plain bibtex  .  this option behaves the same way as the existing  save selected as   option  except that the jabref metadata and signature comment are not written to the resulting output file.,App,UI,IO,Logging,Util
49,minor ui fix: add  save selected as plain bibtex  to the list of open database-only actions.,the  save selected as plain bibtex  menu option is now correctly enabled and disabled based on whether or not a database is currently open.  i haven t included a changelog entry  since this commit effectively just corrects a minor oversight on my behalf when adding this menu entry in [a previous pull request](  but i m happy to add one if deemed necessary.,UI,Logging,App,IO,Util
55,mac bundle and integration for java 7,these changes creates a new compilation target for jabref  in order to make a mac application bundle which can work with the newer oracle jvm for mac (versions 7 and 8)  and change the code of the wrapper to integrate the apple events with the non-deprecated api in com.apple.eawt.  main changes are: - create a new target based on oracle s appbundler to create a bundle compatible with newer jvms. (not compatible with apple s jvm). - move the older target to jabref-legacy.app. - remove the old deprecated wrapper osxadapter  which does not work with oracle s jvm. - create new wrapper based on com.apple.eawt (compatible with both jvms). - improve the quit behaviour. - add support for the fullscreen feature.  the code changes are compatible with both oracle s jvms and apple legacy one  but the legacy bundle is currently broken as the code requires java 1.7+. tested with apple s jvm (1.6.0_65) and oracle s jvm (1.8.0_45).,Logging,UI,App,IO,Util
56,fix double-click opening of files on mac,moving the registration of apple events ensures that double-clicking on a file to open it works even if jabref is not yet running.,Logging,UI,Util,App,IO
65,replace usages of preferences by string through constants,i checked all the usage of strings for getting or setting preferences and replaced them by a the usage of a constant  if one existed. this gives some more static checking and consistency throughout the project. changes are limited to  src/main/java .   again this changes nothing functionwise  but only improves code quality.,interpreter,DB,Search,Network,Util,APM,IO,UI,Logging,Logic,App
66,fixed incompatibility with inspire output page,due to a change in the html output of the inspire search  jabref was no more able to distinguish the interesting output from the rest of the page. it was due to a missing newline character.,Util,IO
74,refactor globals,this pull request reduces the infamous globals class to one third of its size. this is achieved by extracting every variable or method that is only used once to the position of its usage. in the case of char maps several map classes have been extracted.,Logging,App,Network,IO,Util,Test
75,code style,some minor code style cleanups.,App,Util,interpreter,UI
77,code style,more minor code style cleanups.,Logic,Logging,UI,Network,Test,Util,IO,App
89,removes splash screen,this pr removes both the splash screen and the cli option to disable the splash screen.   why? - splash screen on modern systems is shown only for a very short period of time as jabref starts fast - we should focus on making jabref to start as fast as possible. a splash screen reduces the time to start the software as additional code needs to be executed.  - for each new version (even for beta and dev versions)  we have to check in a png with 200kb file size into the repository. this increases the amount of storage required for the git repository by 200kb for each version/dev-version. - the splash screen interferes with using jabref via the cli.  - it reduces code in jabref. hence  less code needs to be maintained.  this is a pr that is open for discussion. please add any pros/cons as you see fit.,Logging,App,Util,interpreter
93,logic improvements (java 1.7+),this pull request features various improvements of the classes in the logic package with the aim to transition beyond java 1.6 and improve quality. in particular: - updates license headers with current date - syntax optimizations: java 1.7 use of generics (diamond operator) - format code according to java conventions (c-style curly brackets  i am looking at you) - improves exception handling with logging - replace usages of exception with more precise exceptions - improves variable names - removes commented-out code  unused private methods (unused public methods/constructors are not eliminated) - use try-with-resources if possible - delete stale comments - replace stringbuffer with stringbuilder - remove history information from javadoc  (i am aware that i could push this directly  since i am now a contributor. as this started out as a pull request  i want to finish it as such. future cotributions will be made directly to jabref/master),Test
99,rewrite doi parsing,i rewrote the doi parser as it was hard to understand and missing quite a few valid dois. it s not 100% but should be a lot better than before. - clearer and more permissive regex - better url encoding and decoding - more test coverage  any comments before merging this into master are appreciated.,App
100,move and refactor entryeditor,moves the classes related to the entryeditor into a separate gui package and performs a few refactorings and quality improvements on the way.,App,UI
101,full text crawlers,**this pr enables automatic pdf fulltext downloads.**  current catalogs:   - acs - arxiv - springer - sciencedirect (elsevier) - google scholar  questions:  - do we want to include more crawlers? if yes  which? - action was in the  tools  menu. imho it should be either auto downloaded or included with the  download or  auto  button in the detailed entry view.  todo: -  make it nonblocking and keep the progress bar! -  add an option to delete the local file if a wrong file was downloaded -  tests on travis & circleci are blocked by google by  403 forbidden  (bot detection),Util,Test,IO,Logging,Network,App
105,move jabrefframe and basepanel to the gui package,this pull request moves the two central gui classes   jabrefframe  and  basepanel  to the gui package.   to preserve visibility constraints  this requires the relocation of many more classes that have package-local dependencies on the above two classes.   variables / methods in  jabrefframe  with reduced visibility that are accessed from  jabref  were made  public   since the latter class clearly does not belong to the gui package.,APM,Logic,Logging,Util,i18n,DB,IO,Network,App,interpreter,UI
108,extract model package with core data classes,this pull request extracts the most central data classes from the root package and puts them into a separate model package. it was possible to remove all gui dependencies from these classes.  additionally  all classes in the model package are refactored and adjusted to java 8 syntax.,Util
127,minor improvement in googleurlcleaner #126,fixes detection of domains such as google.co.uk / co.jp / etc. and moves test class to test folder.,Test,App
137,unify and simplify gui actions,- using lambdas for the simpler actions - some code cleanup - extract string commands as string constants to actions.java and use the constants in jabrefframe  basepanel and rightclickmenu - use the constants already defined in keybinds to get keystrokes for the actions (in jabrefframe  basepanel  entryeditor and rightclickmenu) - 8e3ad9d: remove quickfix for [sf.net bug #1277]( and implement feature properly: instead of deactivating  show/hide toolbar  when no database is open  the action has been move to jabrefframe and works now even if no database is open.  see also #136,IO,Util,App,Logging,interpreter,UI
143,fix sf bug #1285,restores the cursor resp.  caret  position when a field is store during editing. this fixes [sf.net bug #1285](  to be done:  - backport to dev_2.11 - ask for confirmation on sf.net and close the issue there.,App,UI
147,remove option to set custom icon theme,the setting of a custom icon theme is not available in the gui. because of this  i removed it.   what is changed: - no support for custom icon themes anymore - a smaller guiglobals class - more explicit referencing of icons - less setup logic that is required to be called explicitly - when no icon is available  the default one (red.png at the moment) will be used. this allows to detect icon errors -> see below - less code  uncovered issues through this change: - the action openfolder is used in the icon bar  but as it had no icon  it was never displayed to the user. this is now marked explicitly in red  allowing us developers to fix this.  i am open for feedback.,Network,App,Util,UI,Logging,IO
150,removes the legacy-action integrity check,removes the **legacy**-action  tools--> legacy tools --> integrity check  with all its files.   what it helps: - removes 1000 lines of code - removes a feature that is marked as a legacy tool  what does the feature do at the moment: - check year: raise error if it contains a 4digit number - check title: warn only about wrong braces - check author/editor: check that the structure is correct using  and  and the     separator.  anyone who wants this feature to stay?  is there any other validation facility in place where we could add the checks instead?,Network,IO,App,Interpreter,UI,Util,interpreter,Logging
164,small changes to default preferences,- fields in table are not colored (required/optional) - owner column is not shown - slightly increasing row padding in table,Util,Network,Logging,UI,App,IO
165,timestamp is not displayed by defaut,as discussed in #164 the timestamp column shouldn t be displayed by default.,Network,Logging,IO,UI,Util,App
175,increase saving speed,intended to 122  this pr turned into a major api change. it replaces  string  in the return types of  bibtexentrytype  with  list<string> . this allows to return immutable lists instead of mutable arrays and improves the stability of the program. additionally  the rewrite allowed to replace a lot of duplicate object creation with instance variables.  with respect to #122  the immutability of the new lists removes the necessity to create defensive copies and therefore avoids a lot of cloning.,IO,UI,Logging,Util,Network,App,interpreter
178,auto detect user language #177,jabref now uses the system locale as default with this pr.  i simplified some methods in the process and implemented a fallback to  en  when there is no bundle for the default locale.  any suggestions?,Logging,Util
187,fix linebreaking,evaluating the usage and problems of #114. what is fieldcontentparser really doing? what is jabref style formatting?,DB,interpreter,App,IO,Util,Logging,Network,Logic,Test,APM,UI
192,improved casechangers,new attempt with the same code and same limitations  but using branches. so hopefully possible to merge. i also used the jabref formatter and clean up. hopefully  i got it correct.,Test,Util,App
204,added pushing citations to texmaker,implements sourceforge feature requests #318 and #582.,Logging,IO,Network,App,UI,Util
205,replaced defaultformbuilder with formbuilder,replaced the deprecated defaultformbuilder with formbuilder in about ten instances.  as i was working with the external programs code  the strings there were unified to ease the translation work a bit.,Util,UI,App,IO,Logging
206,added ability to merge from a downloaded doi based bibtex entry,- refactored mergeentriesdialog by splitting into a mergeentries providing a jpanel for merging and the dialog and moved these into gui.mergeentries - added mergeentrydoidialog to merge with a bibtex entry downloaded based on doi  e.g.  to add missing information or correct - added that functionality to the right-click menu for the entry table - made getentryfromdoi in doitobibtexfecther public to be able to use that to get the bibtex entry - added a new icon for doi (which probably should be used in other places),UI,App,Util
215,adding an advanced data structure for title/word in the casechangers …,…implementation.  @koppor this is what i ment. what do you think?,Test,App,Util
217,remove the option move-to-systray,why? - only applications that do background work are put in the systray  e.g.  dropbox or anti-virus-software.  - other software stays in the normal task bar - jabref currently does no background stuff  hence  should stay in the task bar only  gains? - less code - lesser quirky workarounds (see commit),Logging,IO,UI,interpreter,Util,App
219,ieee journal abbreviations,why? - see #173   what is does: - bugfix: correct abbreviations are loaded when storing preferences through the advanced tab - ieee abbreviations are either plain (text) or in latex (code) form. for each of them  a separate file exist now. the config option  use_ieee  loads the latex one if it is true  and the plain one otherwise.,App
225,replaced defaultformbuilder with formbuilder,another batch of replacing the deprecated defaultformbuilder with formbuilder: autosetexternalfileforentries  basepanel  colorsetuppanel  dbconnectdialog  fromauxdialog  managekeywordsaction  masssetfieldaction  and synchronizefilefield.  clean up in util.java.,Logic,Network,interpreter,UI,IO,App,Util,Logging
227,merge entries in duplicate detection,added a  merged entry  tab and preview/textbox in the duplicateresolverdialog and added handling of this at import and duplicate checking.  also fixed a bug leading to that if import was done without the importinspectiondialog  nullpointerexception happened as the metadata was not properly initialized.,Util,UI,App
229,trying to extend the scheduler interface according to the comments at,i ve tried to extend the  scheduler  interface according to the discussion at issue #19. if i understand this correctly  most of it can be done via the  abstractscheduler .  i hope this helps. please have a look.,Util,UI,interpreter,Logging,Network,IO,App
232,architecture,adds a the architecturetests class that ensures that specific packages stay independent from other packages.  why? - ensure that the architecture of jabref stays healthy.,Test,IO,Util,App
235,schedulers interface (merging and adding to pull request 229),merging and adding to pull request  from @jmhofer which adds functionality discussed in the scheduler issue   work done in  added the following methods to  scheduler : -  subscription schedule(t state  func2<scheduler  t  subscription> action  long delaytime  timeunit unit)  -  subscription schedule(t state  func2<scheduler  t  subscription> action)   these are in fact the primary methods from rxnet ( and the others are just helper overloads.  it seems beneficial to use these 2 methods for actual implementation logic while all other methods are just decorating and forwarding from abstractscheduler to these methods.  i propose these changes on top of pull request  to achieve this.  i also added unit tests that @mairbek created (  all unit tests are passing … but we don t yet have enough unit test coverage so i won t be surprised if bugs are found.,Util,IO,Logging,interpreter
236,simplify key bindings,currently  there is a key binding for  push to application  but there can be key bindings for each specific application  e.g.  lyx  vim  etc.  to simplify  there should only be a key binding for the currently selected application  hence  only the  push to application  key binding.,i18n,Logging,Util,UI,IO,Logic,App
237,less console output in tests,reduces console output during tests dramatically. this reduces the console output in travis  helping to find the cause for a failing test faster with less scrolling.,App,Test,IO,Util,Logging,Logic
239,remove edit preamble and edit strings from toolbar. it is still avail…,…able under the bibtex menu.,App,IO,Util,UI,Logging
241,set default encoding to utf-8,the utf-8 support of latex  [biber]( and [latex editors]( is really mature. to have interoperable  .bib  files  jabref should set the default encoding (for new users) to  utf-8,Logging,App,Util,IO,Network,UI
248,removes button to merge entries and keep the old ones.,- renames merge button into  merge entries . - removes button to merge entries and keep the old ones. the old ones are now always deleted.,UI,App
251,removes legacy options to sync files in the  pdf  or  ps  field,why? - these legacy actions are replaced by using the  file  field and a much more sophisticated file sync action.,App,UI
253,cleanup preferences,this pr remove preferences that are no longer used in jabref.  i checked the usage each public field of  jabrefpreferences  and  if there was no such usage  searched for string occurrences of the preference value in the complete project. if such usage was found  i replaced it with a usage of the respective field. otherwise  i deleted the preference.  all in all  only a surprisingly small amount of preferences is not used.,IO,Logging,App,Util,Network,UI
259,fixed some warnings  missing copyright statements  and some minor issues,pushtoemacs is causing formatting problems (works with manual formatting)  but other than that  i believe that everything should be ok.,Network,IO,Util,Logging,Logic,UI,App,interpreter
266,removed a number of warnings  added copyright etc,cleanups based on warnings  primarily: - removed right-hand side arguments of diamond operators - static functions - commented empty blocks - added try-with - avoided hiding variables  included copyright statements.,interpreter,App,Util
267,removes option to hide the bibtex code tab in the entry editor.,why? - i do not see the point of hiding the bibtex code tab in the entry editor. hence  i removed the option.,interpreter,Logging,App,UI,IO,Util,Network
274,save size of mergeentrydialog and mergeentrydoidialog,as per @koppor s request (sort of)  the  mergeentry*  dialogs now save and restore their size and position (same for both).,App,UI,Util,IO,Logging
276,refactor bibtex model (a bit),- renames getallfields() to getfieldnames()  - add getfields() method  often the workflow in our code is:      java for(string name: entry.getfieldnames()) {   entry.getfield(name)    // do something }      we can directly use  entry.getfields()  for this now. are there any concurrency problems behind the old rationale or was it just dumb?,App,Logging,Util
283,replaced print-out messages with logger,added logger instead of print-outs in a bunch of places.,UI,Util,Logging,IO,Network,App
286,fixed a number of warnings,got rid of a number of warnings: - <> - static methods - commented empty blocks - general clean up,Util,Logging,Logic,Test,IO,App
