4046,add missing translation for  html to unicode,all formatters return a localized  getname . the only exception is the  htmltounicodeformatter . this pr fixes this.,App,interpreter
4047,a first solution for the cli problem #4038,exportfactory is not initialized at this execution point,Network,App,Util,UI,Logging,interpreter
4054,restructure startup,considered as necessary when reviewing #4047,UI,Util,App,Logging
4056,extract old bibtex key generation action,4000,Logging,i18n,App,Util,UI
4057,4041 to make push to application work again on osx.,for unknown reasons  it seems no longer possible to give the command,UI,App,Util,Logging,IO
4058,cpu leak,see #3943,App,Test,Util
4059,change date parsing warning to debug statement,,UI,Logging,Network,App,Util
4060,small fixes,,UI,App,IO
4061,groups right click,,Util,IO,UI,interpreter,Logging,App,i18n
4074,mac graphics,4070,interpreter,Util,DevOps,App,Interpreter,IO,Logging,DB,APM,Network,Search,UI,Logic,i18n
4100,migrate review field in entry preview to comment,migrate review field in entry preview to comment,App,Util,Test
4105,fix that sometimes an empty side pane is shown,,Util,App
4106,opens the directory of the currently edited file when opening a new file,opens the directory of the currently edited file when opening a new file,Logging,IO,App,Util,DB
4107,fix a few things in entry editor,,UI,Logging,interpreter,Util,DB,APM,Test,App,IO,Logic,i18n,Network
4109,smooth shutdown,,Logic,APM,UI,Network,App,DB,Util,Test,Logging,IO,i18n,interpreter
4111,fix open thread prevents shutdown,@tobiasdiez  as this is just contains the relevant fix and works for me  i would be in favor for using this pr. you could still have your pr as refactoring pr then,Network,Util,App,APM,UI
4123,fix convert to bibtex moves contents of the file field,4120,App,DB,IO,Util,Logging
4124,saves and reloads window state on close and on open,saves and reloads window state on close and on open.,App,Util,IO,DB,Logging
4128,fix build,,App,UI,IO,Network,Test,Util
4137,3805: dash correctly terminates commands in layout files,,Network,UI,Logic,Logging,i18n,App,interpreter,IO,Util,DB,Search,Test,Interpreter,APM
4138,single line text fields,solution for 4126]( i ve used text formatter to force single line behavior. hope it s enough :) particular fields  that should contain only one line  are stored in immutable set.,interpreter,App,Network,Util,UI,Search,i18n,Security,IO,DB,Logging,Logic,Test
4139,convert doaj fetcher to new interface,,interpreter,Test,App,IO,Search,UI,Network,Logging,i18n,Util
4141,convert springer fetcher to new interface,,Util,Test,Logging,App,Search,Network,IO
4144,convert acm fetcher to new infrastructure,,App,Logging,Test,Network,interpreter,UI,IO,Util,Search,i18n
4180,improve error message for fetchers,,IO,App,Logging,Network,Search,Util
4181,4134: no longer freeze when clicking browse in aux import dialog,,App,UI
4182,fix not on javafx thread exception in  generate data from doi,,App,UI,Util
4184,3062: ctrl + f selects search field again,,Util,Logic,i18n,IO,Logging,UI,App
4185,convert citeseerx fetcher to new infrastructure,the old implementation first extracted the detail pages for each article matched by the query and then went to every detail page to extract the bibliographic information. instead  we now parse the coins information that is already contained in the main result page and thereby reduce the number of requests to 1 per query.,Search,App,Util,Network,IO,Test
4203,rewrite web search pane in javafx,,Util,UI,App
4212,make attached files relative to the file directory,4201,App,UI,IO,Util
4216,fix fetcher tests,fix fetcher test and fix l10n logging for test,Search,Util,Network,Logging,App,interpreter,IO
4245,fix style issues in about dialog,,Network,Util,i18n,UI,Interpreter,Logging,App,IO
4246,solved #3823 file annotation,this pull request solved #3823  and improved the new line remover.,UI,App,Util,Test
4252,fix attach file does not relativize file path,4241,App,IO,UI,Util
4255,fix for issue koppor 254 (auto cleanup url),,App,UI,Util
4259,remove spin comments,4192,App,UI,Logging,IO,Util
4260,fix for issue 3959: migrate all tests to junit 5,,App,Test,Util,Network,IO
4261,fix display of checkboxes,,UI,App
4268,convert part of the issue#3861 quality->cleanup entries,,Util,UI,App,IO
4275,changed the behavior of the field formatting dialog,i made the loops for formatting all fields in the fieldformattercleanup class test for not being the key_field.  i originally had this in the cleanupsinglestring method to prevent key_field from being cleaned up (reformatted) entirely  but decided to let the user specifically format that field.  when the user chooses to format all fields at once  however  the key_field will be not be reformatted. this solves issue 4148](4148),Network,interpreter,IO,Logic,i18n,Util,App,Logging,UI,Test,DB
4277,convert bibtexkeypatterndlg to javafx as well,4253  in the bibtex key pattern panel there was an exception thrown if you had defined custom entry types or used biblatex mode.,interpreter,App,UI
4278,fix npe with bibdatabasecontext in preview style dialog,3765. i discovered an npe with the bibdatabasecontext in the newdroppedfilehandler.,Logging,UI,App,IO,Util
4280,improve preferences,,Network,IO,Logging,Util,UI,App
4281,fix npe when importing from cli,,App,IO,Util
4282,added a comment for the purpose of the class,this is a comment that describes the purpose of a class.,App,Util,Logging
4284,fix exceptions when trying to change settings,i also took the opportunity to improve a few things around our localization code (mainly converting languages to enum).,Test,Util,App,IO,UI,Logging,Network
4289,fix npe in merge entries dialog,4233,App,UI
4290,fix error prone warnings,fix a few things found by error prone.,Test,Util,Network,i18n,UI,IO,App
4291,fix loading and storing of xmp field exclusions,4072,App,Test,Util,IO
4299,fix freeze on import into current library,execute import inspetion dialog in swing thread,IO,Util,Logging,App
4302,convert to circle ci 2.0,i just found that @koppor  already had a  branch and configuration for circle ci 2.0,Interpreter,Logging,IO,APM,Search,Network,interpreter,Test,Logic,App,i18n,Util,UI,DB
4309,completely rework save operation,,Util,UI,Logging,IO,App
4311,fix drag and drop in entry editor,4305,App,Logging,UI,Util,interpreter,IO
4312,convert new entry dialog to javafx,followup from  #4266,App,Util,UI,IO,Logging
4314,readd status line in form of a snack bar,,Util,App,UI,Logging,IO
4317,fix that  rename and move file  throws file not found exception,4307. moreover  i refactored a bit how files are renamed/moved to the default file directory. this should make it easier to reuse the code.,Test,Util,App,Logging,Network,interpreter,IO,UI
4325,wrap preferences in scrollpane as well,don t override pref size,UI,IO,App
4326,fix height of entry editor fields,some of the text fields didn t use all the available height  which resulted in a unharmonic display. this is now fixed.,UI,interpreter,Network,Util,App,Interpreter,Logging,IO
4327,save sort order column of main table,4224,Util,App,Logging,UI,Network,IO
4333,fix entry editor field display,some of the entry editor fields were not using all the available height which resulted in an inhomogenous display. this is fixed now.  i also marked more fields as  singleline . moreover  singleline fields are now vertically centered (i m not sure if i like this change or not - but i couldn t find a way to make text in text fields not centered).,IO,Test,interpreter,Util,NLP,UI,App,Network,i18n,Logging
4335,fix that web search pane steals input,fixes  by making the search button in the web search pane not the default button.,App,UI
4336,remove globalfocuslistener and old textfield entry editor,fixes 4324.,Logging,Util,App,IO,UI
4337,fix export of corporate author to msoffice,fix tests,Util,App
4338,added new keyboard shortcut  ctrl+e  for closing the entry editor. (#4222),enhancement presented here [,App,IO,Util,interpreter,Logging,UI
4341,convert oo/lo sidepanel to javafx,converted the oo/lo side panel to javafx. ported all dialogs do javafx.,App,Util,IO
4351,fix freezes in entry editor,fixes  and probably fixes  as well. the reason for the freezes were the pull-request  these changes mess up the layout for some reason. the fix is to inject a decorationpane ourselves directly from the beginning. although this fix started as a workaround for this bug in controlsfx  i think  we should keep it permanently for performance reasons.,DB,Logging,Util,IO,Logic,App,UI
4354,fix javafx thread exception when fetching new infos,fixes javafx thread exceptions by reworking the swingworker using javafx backgroundtasks.,Logging,Util,App
4355,auto trim url field,,Util,App
4367,arxiv fetcher support  url,in this pr i wanted to fix the issue from 328](328).,Util,App,Search,Network,IO,interpreter,Logging
4369,fixed testexportasmodsandthenimportasmods,,IO,Test,App,Util
4379,change latex command handling only for xml chars,refs #3838,Util,App,IO,Test
4390,fix entrytype dialog not closed after generate button,when generating an entry from an doi or similar  the entry was inserted  but the dialog not closed.,App,Util,UI,interpreter
4394,convert exporter customization dialog to javafx,this is my work so far.  i am just beginning the dialog conversion and wanted to share my reasoning so far.  what i am doing is listed in the comments in class  exportcustomizationdialogviewmodel .,IO,App,UI,Logging
4396,fixes for all mods exporter tests,,Util,App,Test,IO
4400,fix violations of always use braces,since @tobiasdiez already proposed the always use braces rule in   i just went ahead and fixed the violations in the code.,Util
4404,fixed an issue where corresponding groups are sometimes not highlighted when clicking on entries,fixes 3312](3112),UI,Util
4405,show dialog before creating entry,#4360,App,IO,Util,UI,Logging
4408,add a preference to add files in entry editor,this pr for #4356 mainly involves,Util,UI,App
4413,fix group hit counter when adding entries,3537 by replacing the eventbus subscription by a javafx listener.,UI,App,Util
4415,searchable/filterable preferences,1019,UI,Util
4419,update readme.md,remove obsolete integration test description. add a note on travis,Util,App,UI
4420,fix highlight color of selected text and progress bar,in the progress  also a few npes in the themeloader were fixed.,Util,IO,Network,Test,App,Logging,UI
4426,fix arrayindexoutofboundsexception on second pdf import,4422,IO,App,Test,Util
4428,fixed radiobuttons in preference menu (#4409),previously multiple radiobuttons in preference menu belonging to the same group were selectable simultaneously. this issue is now fixed on multiple occasions  allowing only one option per group to be selected at the same time. issue: 4409](4409),UI,App
4431,add citation styles as git submodule,this pr is prepares #3421 by removing the dependency on  org.citationstyles:styles:1.0.1-snapshot  and instead embedding it as git submodule. this builds the citation styles directly into the jabref jar.,IO,Network,Util,UI,App
4439,fix groups drag and drop,fix a bug with drag and drop groups.,App,IO,i18n,UI,Util,interpreter,Logging
4444,improve mathscinet fetcher and add isbn fetcher to entry editor toolbar,makes the mathscinet fetcher more reliable in the case the entry already contains a mrnumber.,Util,Test,App
4445,add eprint cleanup,adds a cleanup operation that detects an arxiv identifier in the note  journal or url field and moves it to the  eprint  field.  i also took the opportunity to convert the cleanup panel to fxml and somewhat simplified/refactored the code around the cleanup.,interpreter,Search,App,Test,Network,UI,Logging,IO,Util
4446,set auto-update checkbox enable/disable when reading preferences,this patch addresses issue 4427]( added a call to the existing event handler (which enables/disables the checkbox in response to user clicks) when we set the checkbox value from the preferences.,UI,IO,App
4448,change location of some fields in the entry editor,- journal/year/month in biblatex mode -> deprecated (if filled) - doi/url: general -> optional - internal fields like ranking  read status and priority: other -> general - moreover  empty deprecated fields are no longer shown,Util,App
4452,added extra stats to be sent with mrdlib recommendations,* added the following stats to hopefully improve quality of recommendations:,App,Network,Util,IO,Logging
4453,fix error in l10n file: toogle -> toggle,,UI,App
4468,respect preference state,address issue [4427]( where the saved state of the update timestamp checkbox is not restored.,IO,UI,App
4470,3189 fix group renaming,fix group renaming #3189 .,App,i18n,IO,Logging,Util,interpreter,UI
4484,4467 - fix save button,: #4467,App,Util,Logging,UI,IO
4498,improve page checker,superseeds the pr #4188 and 4113. now page ranges like  r2-r5  are considered to be correct.,Test,Util,App
4505,create test,refactor  savedatabaseaction  send  jabrefpreferences  via constructor parameters.,IO,App,Util,Test
4507,bump java-diff-utils from 2.2.0 to 4.0,bumps [java-diff-utils]( from 2.2.0 to 4.0. <details> <summary>commits</summary>  - see full diff in [compare view]( </details> <br />  [![dependabot compatibility score](  dependabot will resolve any conflicts with this pr as long as you don t alter it yourself. you can also trigger a rebase manually by commenting  @dependabot rebase .  ---  <details> <summary>dependabot commands and options</summary> <br />  you can trigger dependabot actions by commenting on this pr: -  @dependabot rebase  will rebase this pr -  @dependabot recreate  will recreate this pr  overwriting any edits that have been made to it -  @dependabot merge  will merge this pr after your ci passes on it -  @dependabot cancel merge  will cancel a previously requested merge -  @dependabot reopen  will reopen this pr if it is closed -  @dependabot ignore this [patch|minor|major] version  will close this pr and stop dependabot creating any more for this minor/major version (unless you reopen the pr or upgrade to it yourself) -  @dependabot ignore this dependency  will close this pr and stop dependabot creating any more for this dependency (unless you reopen the pr or upgrade to it yourself) -  @dependabot use these labels  will set the current labels as the default for future prs for this repo and language -  @dependabot use these reviewers  will set the current reviewers as the default for future prs for this repo and language -  @dependabot use these assignees  will set the current assignees as the default for future prs for this repo and language -  @dependabot use this milestone  will set the current milestone as the default for future prs for this repo and language -  @dependabot badge me  will comment on this pr with code to add a  dependabot enabled  badge to your readme  additionally  you can set the following in your dependabot [dashboard]( - update frequency (including time of day and day of week) - automerge options (never/patch/minor  and dev/runtime dependencies) - pull request limits (per update run and/or open at any time) - out-of-range updates (receive only lockfile updates  if desired) - security updates (receive only security updates  if desired)  finally  you can contact us by mentioning @dependabot.  </details>,UI,Logging,DevOps,Util
4519,fixed 4365 put html in clipboard,4365 .,Logging,App,Util,UI,IO
4520,optimize data fetching,optimize fetching data from database,App,DB,Test,Util,Logging
4533,add preselect last used export format in export to clipboard dialog,add feature to store last selected export file type  and preselect that type the next time the dialog to export to clipboard is fired.,Logging,UI,Util,App,IO
4547,do not extract file ending from urls,4544 do not extract file ending from urls,NLP,IO,App,Util,Network
4549,fixes that renaming a group did not change the group name in the interface,3189.,UI,IO,i18n,interpreter,App,Util,Logging
4553,cleanup interfaces,some interfaces were with the access modifier public these were removed since they are redundant,IO,Util,App
4554,refactor bibentry deprecated method,refactored bibentry deprecated constructor,Util,IO,App,Test
4555,automatically created groups with field to group by as entrytype (#4539),,IO,Util,NLP,Logging,App,i18n,interpreter,Test,Network,Logic,Search,UI
4560,delete the deprecated bibentry constructor,this is the followup for   which removed the usage of this constructor. this pr also deleted this code.,Network,Logging,UI,Util,App
4565,add uncaught exception message,added a simple dialog showing up if an uncaught exception was logged.,Logging,App
4577,don t set column sort type at startup,fix performance issues,Util,IO,interpreter,Logging,UI,App
4587,add a variable to track the change in preview style,proposed solution for #4580:,App,Logging,Util,IO,UI
4596,mr dlib label  error handling  display confirmations,this pull request contains 4 improvements to the related articles tab:,Logging,IO,Util,App,Network
4601,convert duplicateresolverdialog to javafx,4598,IO,Util,Logging,UI,App
4602,convert new version dialog to javafx,,Util,IO,UI,Logging,App
4604,enable default cursor for new entry,4600.,interpreter,App,Util,UI
4605,convert  show preferences  dialog to javafx,,App,UI,Util
4607,convert  from aux file  dialog to javafx,,interpreter,App,IO,Util,UI
4608,convert  customize importer  dialog to javafx,,Util,UI,Logging,IO,App
4613,fix preview style configuration,4609.,UI,Util,Logging,IO,App
4617,convert libraryproperties to javafx,converted the library properties dialog to javafx,App,UI,IO,Logging,Util
4634,remove old code for pdf import,,Util,Network,IO,Test,App
4642,4591] add integrity check for books with edition reported as 1,4591,Util,App
4644,fix for issue 4641: remove usage of tempdirectory extension from junit-pioneer,fixes: #4641,App,Network,Util,IO,Test
4658,fix for #4628 - cant save new content selectors,4628,interpreter,App,Util,UI
4660,4610. changed the way the groupdialog description is displayed.,fixes 4610](4610),UI,App,Util
4692,rework import inspection dialog in javafx,,Network,App,Util,APM,UI
4693,rework external changes dialog in javafx,,UI,App
4694,remove global search feature,,Logic,Logging,i18n,UI,App,Util,IO
4696,remove resolve duplicate keys dialog,,App,Logging,UI,DB,Util,IO
4697,convert  wait for save  dialog to javafx,,App,Util,Logging,UI,IO
4698,catch numberformatexception in bibtexml exporter,,IO,Logging,i18n,Util,App,interpreter
4701,convert manage keywords dialog to javafx,,UI,IO,Network,Util,App,Logging,interpreter
4702,improve parser warnings,based on   in which a user (rightfully) complained that the error message is not very helpful.,Util,Logging,App,IO
4707,group and reorder the main menu (tabs & icons),group and reorder the main menu (file  edit  library  quality  tools  and view tabs & icons). now it looks like on the @martinkarim s prototypes.,App,Network,Util,UI,IO,interpreter,Logging
4708,disable rank column by default,closes 4585.,Util,IO,Network,App,UI,Logging
4711,convert  manage external file types  dialog to javafx,,Interpreter,Util,IO,App,interpreter,Network,DB,Logging,UI,Test,i18n
4713,fix: bibkey generated does not handle diacritics,4709.,Logging,Util,App
4715,convert  protected terms  dialog to javafx,,App,Util,IO,Logging,UI,Network
4716,temporarily remove  customize entry types,,Logging,IO,UI,Util,App
4717,remove  plain text import  feature,,APM,Interpreter,DB,interpreter,UI,Search,IO,Util,App,Logging,Logic,Test,Security,Network,i18n
4720,4703: newline format couldn t be changed,4703.,UI,App
4722,adding additional modifiers to be used in bibtex key generator,as i currently wanted to have a possibility to have  capitalized shorttitles  in my bibtex keys i reused the already existing  capitalizeformatter    titlecaseformatter  and  sentencecaseformatter  as  modifiers  to be used also for the bibtexkeygenerator.,Util,App
4727,4306] disable renaming,4306,UI,IO,interpreter,Util,App,Logging,Network
4729,saving changes and exiting application,4728,IO,Interpreter,UI,i18n,Network,Security,App,APM,Util,Logic,interpreter,Test,Logging
4730,improve toolbar icons and their layout,group and reorder the toolbar icons and add  generate bibtex keys  button. now it looks like on the @martinkarim s prototypes. <br>,App,Util
4731,fix default import format pattern,remove display array,App,Logging,Test,UI,Util
4732,4494] add key bindings,4494,Util,App
4738,adding support for input methods,4474,App,interpreter,UI,IO,Util,Logging
4739,remove old swing-based tests,,IO,App,UI,Util,Test
4741,revert  fix: bibkey generated does not handle diacritics,reverts jabref/jabref#4713,Util,App,Logging,Test
4742,revert  revert  fix: bibkey generated does not handle diacritics,reverts jabref/jabref#4741,Test,Logging,App,Util
4744,move library specific key pattern dialog call to library menu,follow-up of #4666 and #4707: menu entry  bibtex key patterns  is calling a library specific dialog to set key patterns. the global key patterns are managed using  options  ->  preferences .,IO,UI,Logging,App,Util
4746,switch to the mariadb connector from the mysql one.,switch from  com.mysql.cj.jdbc.driver  to  org.mariadb.jdbc.driver .,interpreter,Logic,DB,Interpreter,IO,i18n,APM,App,Util,Test,Logging,Network,UI
4750,code optimized and created a reusable method to get writer output,,interpreter,App,Test,IO,Util
4759,feature: implement search filter in show preferences,add a search box in show preferences window to allow users to filter,App,UI,Util
4760,improve remote messaging,4023 (multiple instances possible) and should 4481 by reducing the timeout (thus jabref does no longer waits seconds if a proxy prevents us from connecting to localhast). surpasses #4460.,Logging,UI,Util,Network,IO,App,interpreter
4761,enable import button only if entry selected,,UI,interpreter,Util,App,IO,Logging,Network
4769,fix removing entries when source-code-field is out of focus,4764,App,Logging,Util,UI,IO
4779,fix illegalargumentexception when ranking entries,add names for ranking entries event so it does not generate an illegalargumentexception.,Interpreter,i18n,NLP,interpreter,App,DB,IO,Util,Search,Network,Logging,UI,Test,Logic
4787,remove unused swing code,,Util,IO,UI,App,Logging,interpreter,Network
4791,fix npe in duplicate resolver dialog,4785,IO,App,Logging,UI,Util
4792,relativizes paths to aux files,,Util,App,UI,IO
4794,fix closing of library not handling backup and autosave manager shutdown,4789,IO,UI,App,Logging,Util
4797,fix right clicking on any entry and selecting  open folder  results in the nullpointer exception,4763,Search,Network,IO,Interpreter,DB,UI,NLP,App,i18n,Logging,interpreter,Util,Logic,Test
4803,improved and added documentation,while looking at the code  i observed obsolete documentation patterns which did not confine to the documentation guidelines.,Logging
4807,item count in a group updated correctly,,Util,UI,App
4815,enhanced message log,worked on  4805]( .,Network,App,Logic,Test,Logging,interpreter,IO,Util,i18n,UI,Interpreter
4818,put renaming of file entries in javafx thread for cleanup,closes #4817,Logging,IO,Util,App
4822,convert autolinkfilesaction to javafx,4819.,Logging,Util,Network,interpreter,IO,UI,App
4823,moved cleanup out of background thread to stick with the architecture…,@r0light  and i tried to resolve the build issue introduced by #4818 as a temporary solution.,Util,App,Network,Test
4835,all buttons in custom dialogs react on enter,all buttons in custom dialogs react now also on <kbd>enter</kbd>. (the default behavior <kbd>space</kbd> in javafx is not affected by this change.),App,Util,UI
4838,adds a delay to the group expansion,adds a delay to the group expansion action. the delay is currently 1 second and only expands the group.,Util,IO,UI,interpreter,Logging,i18n,App
4839,fix parser exception when loading tex-groups with non-existing file,4735.,App,IO,Network,Util,Logging
4847,removed default constructor of fxdialogservice,fix for #4840. needs test and discussion,Logging,IO,App,Util,Logic,DB,UI
4848,fix custom name formatters,3531.,Logging,App,Util,IO,Test
4860,remove deprecated awt apple extension,3905,App,Util,UI,IO,Logging
4872,toggle enable status of menu items,,interpreter,App,Logging,UI,Util,IO
4876,fix saving of strings,fix removing of strings,IO,Network,Security,Test,Util,UI,Logging,interpreter,App
4884,improve snackbar dialogs for copy to clipboard menu,-  removed an unnecessary message when copying to clipboard (see  citationstyletoclipboardworker.copycitationstyletoclipboard() ),Network,App,Logging,IO,UI,Util
4885,convert externalfiletypeentryeditor to javafx,last but one swing dialog. the other is pushtoapplication.,interpreter,UI,App,Util
4891,convert pushtoapp settings to javafx,replace runnable with backgroundthread in push,Logging,Security,IO,App,DB,UI,Util,interpreter,Network
4892,fixed closing of the shared database login dialog if the user enters wrong authentication details - #4857,fix for the issue -  dialog close after pressing ok button #4857 - fixed closing of the shared database login dialog if the user enters wrong authentication details.,Security,DB,UI,IO,Logging,Util,interpreter,App
4894,getting rid of swing,since we made good progress in removing swing so far  i created an architecture test to check if swing and jgoodies is still used.,Search,UI,Network,App,Test,Interpreter,Logging,interpreter,Util,IO
4896,store column widths as integer,4579,App,Util,UI
4897,convert search worker to javafx,one of the few things which was still using swing.,App,Util,UI
4898,rework posteopenactions to javafx (custom entry type import),convert dialog for importing custom entry types to checklistview,App,Logging,UI,Network,Util,IO,interpreter,DB
4904,fix some codacy code convention issues,not much to say about this,Util,IO,Logging,App
4918,fixes throwing an exception when  id  field is present in bib file,4905,Test,IO,Util,App
